{
  "$schema": "https://json-schema.org/draft/2020-12/schema",
  "$id": "reasoning-response",
  "type": "object",
  "additionalProperties": false,
  "required": [
    "run_id",
    "task",
    "success",
    "confidence",
    "analysis",
    "findings",
    "risks",
    "missing_evidence",
    "recommendation"
  ],
  "properties": {
    "run_id": {
      "type": "string"
    },
    "task": {
      "type": "string",
      "enum": [
        "researcher",
        "planner",
        "gap-analysis",
        "evaluation",
        "critic"
      ]
    },
    "success": {
      "type": "boolean"
    },
    "confidence": {
      "type": "number",
      "minimum": 0,
      "maximum": 1
    },
    "analysis": {
      "type": "array",
      "items": {
        "type": "string"
      }
    },
    "findings": {
      "type": "array",
      "items": {
        "type": "object",
        "additionalProperties": false,
        "required": [
          "code",
          "severity",
          "message"
        ],
        "properties": {
          "code": {
            "type": "string"
          },
          "severity": {
            "type": "string"
          },
          "message": {
            "type": "string"
          }
        }
      }
    },
    "risks": {
      "type": "array",
      "items": {
        "type": "string"
      }
    },
    "missing_evidence": {
      "type": "array",
      "items": {
        "type": "string"
      }
    },
    "recommendation": {
      "type": "string"
    }
  }
}
